language,multiple,babel,mbxp,humaneval_x,so_2023_language_percent,so_2023_language_rank,so_tags,github_prs,github_pushes,github_issues,github_stars,stack_gb,codeparrot_gb,alphacode_gb,codegen_gb,polycoder_gb,subreddit_members,subreddit_url,anecdote_1_content,anecdote_1_author,anecdote_1_url,anecdote_2_content,anecdote_2_author,anecdote_2_url,anecdote_3_content,anecdote_3_author,anecdote_3_url
VBA,N/A,N/A,N/A,N/A,3.55%,25,"212,313","22,482","77,915","17,439","19,273",2.73,1.91,0,0,0,52.3k,https://www.reddit.com/r/vba/,"It depends on how you use ChatGPT though. I started a VBA project using methods I had used in the past. When that didn’t work, I tried the Google approach, and still couldn’t do what I wanted. Then, I remembered that ChatGPT does code, and decided to give it a shot. Honestly, what it gave me was riddled with errors, but I went through error by error and forced the AI to come up with corrections. I would copy-past the code into the prompt and ask it to identify potential errors and explain how they could be fixed. I got a really intimate understanding of the code, the reasons for the errors, and the strategies for correcting them. Even then, the code was flawed and ultimately failed. But I was able to use some of what I picked up throughout the process to build my own foundation for the code that would eventually work and used the AI to help fill in the blanks. I got a lot out of the experience. It’s very important to ask very specific questions and to make sure that you understand the recommendations that it makes so you don’t get lost in later steps. I used Google to supplement some of the information the AI gave me to improve my understanding. I spent a lot of time with this thing, and I think we both came out of it just a little better at what we do.",u/imartnm,https://www.reddit.com/r/vba/comments/108zy8k/comment/j3zcukr/?utm_source=share&utm_medium=web2x&context=3,"I've tried using it for VBA/Power Query code, but it's spotty at the best of times. It sometimes will reference functions that don't exist, or will ignore the carefully worded instructions you give it. At its current state it's most useful as a glorified google /stackoverflow search. It can also be helpful while debugging or just to throw some suggestions your way. Writing out the basic structure of my module and asking for recommendations/alternatives to certain implementations is fun and has taught me some new tricks. So it's cool, but not really reliable. Don't let it write your code for you or you might risk spending more time fixing it than you would have just writing it. I'd say it's VBA capabilities are better than its grasp on PowerQuery (M) .",u/Confuciusz,https://www.reddit.com/r/vba/comments/108zy8k/comment/j3wn54u/?utm_source=share&utm_medium=web2x&context=3,"Lol I just made a comment on another similar post where OP said GPT was incredible for Excel 😂 But yeah, GPT is still awful for VBA or long formulas. I tried giving clear instructions for simple tasks that it couldn’t get right. It’s cool, but long way to go",u/E_Man91,https://www.reddit.com/r/vba/comments/123zuo6/comment/je3ixwy/?utm_source=share&utm_medium=web2x&context=3
MATLAB,N/A,N/A,N/A,N/A,3.81%,24,"94,777","23,655","266,359","33,289","84,982",Unspecified,0,0,0,0,53.2k,reddit.com/r/matlab,"Yep, pretty much all the MATLAB code ChatGPT write for me worked. There was one instance whereby there was a multiplication that went away as it used * instead of .* To multiply two vectors. When I pointed that out, it corrected the code. In this case it was an order of operations issue and it correctly got it sorted by adjusting the parentheses. Pretty impressive so far.",u/worblyhead,https://www.reddit.com/r/matlab/comments/12fwjx5/comment/jficv03/?utm_source=share&utm_medium=web2x&context=3,"Yes, you can use Co-Pilot with Matlab code. However, it won't work with the usual MATLAB IDE, so you have to use one of the supported IDEs (e.g. VS Code or JetBrains).",u/Latter_Trouble_3227,https://www.reddit.com/r/matlab/comments/y07uop/comment/jbgoj6h/?utm_source=share&utm_medium=web2x&context=3,"Why would you think such a simple plot with callback on click would not work? Now I wonder if it made the callback zoom-safe. I was using update callbacks after only 8 months of college experience with Matlab. And yet, I can’t make chatGPT to give me the correct answer to a function inverse involving rational polynomials (at least the steps it got right, allowed me to remember how to do function inverses)",u/LevelHelicopter9420,https://www.reddit.com/r/matlab/comments/12fwjx5/comment/jfll3tu/?utm_source=share&utm_medium=web2x&context=3
VB.NET,N/A,N/A,N/A,N/A,4.07%,23,"335,092","15,653","35,848","2,915",0,Unspecified,0,0,0,0,145k,https://www.reddit.com/r/dotnet/,"What I've seen from gpt and copilot is that it's a good junior and sparring partner, but it's no substitute for a senior. It lacks reasoning and analytical capabilities to be a true senior. For example, it can tell you the difference between mediator and nservicebus (dotnet environment), but it cannot explain which one you should use for the project you are working on.",u/KenBonny,https://www.reddit.com/r/dotnet/comments/16j8il5/comment/k0qjb6u/?utm_source=share&utm_medium=web2x&context=3,"I've been using it for a LOT of utility classes, regex expressions, and things like that. It's nowhere near replacing my job yet but it's saved me countless hours on some rather trivial but tedious tasks. Most recent today was a function that converts a string to camel case, worked perfectly right out of the gate. Yea I probably could have found the same function on google in 10 min, but I would have had to comb through ads, and useless posts on stack overflow, before I found one I knew would be performant. It's not laziness, the rest of my job is busy enough, I could have spent an hour or two figuring out the logic from scratch but simply put, this is a far more efficient use of my time.",u/Ch33kyMnk3y,https://www.reddit.com/r/dotnet/comments/10s8eld/comment/j704bu4/?utm_source=share&utm_medium=web2x&context=3,"Yeah, I just use the free version but I'll ask it to do something, it kinda does it, I ask, ""Is this part necessary?"" It then responds with oh you're right and redoes it but in a way that still has questions, like I wanted it to explain why it did something the way it did and it takes that as I'm saying it's not really needed. Then I ask it to explain the new changes and it reverts things to the way it did them before thinking I spotted an error in how it redid the code. 🤦‍♂️ I still think it's a nice option to springboard learning or get quick explanations of things with examples, but the more I've used it the less I'm convinced it'll be stealing my job anytime soon. What I actually fear more are engineers and/or middle managers who don't know any better trusting everything it suggests who then think this makes engineers less needed or useful.",u/ModernTenshi04,https://www.reddit.com/r/dotnet/comments/15od4zx/comment/jvr5vur/?utm_source=share&utm_medium=web2x&context=3
R,✅,✅,N/A,N/A,4.23%,22,"499,872","51,800","506,309","88,649","91,654",Unspecified,0,0,0,0,36.8k,https://www.reddit.com/r/Rlanguage/,It's even helpful for example datasets. If you want to test or play around it will create a dataframe example. Also if you know one programming language it can help translate. It will even rewrite the code to look better. E.g. write this code in python pandas but make it more readable like r dplyr. Anything regex is nice as I don't have to hope a specific example is on stack overflow. Chat cpt from my experience will often favor going things with for loops instead of taking advantage of dplyr or pandas functions. With everything chat gpt tho check the code as it will confidently give you an answer and even print out a fake output. Often pointing out its error gets chatgpt to fix the code.,u/2truthsandalie,https://www.reddit.com/r/Rlanguage/comments/17q56xq/comment/k8b2phr/?utm_source=share&utm_medium=web2x&context=3,"I have found it hit and miss. I was able to knock up simple Shiny apps in a minute (https://youtu.be/8oJ1HtkpDt0) but have had it write non-sense code for some other things I was trying (especially webscraping). GPT Studio is pretty good (demo here https://youtu.be/QQfDTLExoNU) but has someone else mentioned, take a look at Github Copilot",u/DrLyndonWalker,https://www.reddit.com/r/Rlanguage/comments/17q56xq/comment/k8bi6nq/?utm_source=share&utm_medium=web2x&context=3,"I do it constantly, not only for debugging which it is spectacular at, but for especially tedious things like using ggplot. If you can think it, GPT-4 and the other specialized models can code it. The real key is to put thought into the question you want to answer with the code and then to very deliberately tell the GPT what to do. For example, “I have a data frame with x, y, z variables. Please write R code to perform a, b, c statistical analysis. Place the results into a variable called results.” And so on.",u/jrdubbleu,https://www.reddit.com/r/Rlanguage/comments/17q56xq/comment/k89wmhi/?utm_source=share&utm_medium=web2x&context=3
Swift,✅,N/A,✅,N/A,4.65%,21,"331,145","425,921","1,334,455","325,962","2,731,776",Unspecified,0,0,0,0,107k,https://www.reddit.com/r/swift/,"Just a general tip: even though it's a bit out of date, chatgpt will answer these questions much faster and sometimes more accurately than Reddit can. I've pretty much replaced Google with chatgpt and my productivity is up and stress is down. For questions about the newest SwiftUI stuff try Google Bard. The LLMs aren't perfect. There's still a place for Reddit and stack overflow, but I'd check with an LLM first.",u/[deleted],https://www.reddit.com/r/swift/comments/174vuyo/comment/k4eayl9/?utm_source=share&utm_medium=web2x&context=3,"I've tried copilot with SwiftUI and it's good for auto generating some things like specific styles, but not so good for other parts. Sometimes it helps with unit tests,but others it gets stuck in a loop.",u/Zagerer,https://www.reddit.com/r/swift/comments/13929qe/comment/jj0pti9/,"Here is my journey coming from C++: Read through ""A Swift Tour"" and follow along in a Swift Playground.  Many times, I feel, ""Huh, this part is so much better than C++."", or ""This is pretty much the same,"" I don't force myself to learn everything though, for example, I skipped protocol entirely. This process took me a few hours. As I dug into SwiftUI, I ran into syntax I didn't understand. Instead of looking up the official document, I just Google or ChatGPT it. When I start doing things in a C++ way that I always hate, I often pause and search if Swift does it better. Oftentimes times, Swift does do it better! Still, I carry some baggage from C++ and later notice if I had done it differently, I would have saved myself a lot of trouble (for example, really thinking about whether things can be null or not). Don't be afraid of re-writing; it is part of the process. Today, I am still learning; however, I started to catch myself speaking in C++ ""accent"" using Swift, and oftentimes, I can Google/ChatGPT my way out of it.",u/AppleHitMyHead,https://www.reddit.com/r/swift/comments/1724gke/comment/k481769/?utm_source=share&utm_medium=web2x&context=3
Assembly,N/A,N/A,N/A,N/A,5.43%,20,"43,572","14,301","119,341","10,605","50,063",2.36,0.78,0,0,0,16.2k,https://www.reddit.com/r/asm,"Assembly isn't one language, it's a general term for any human-readable representation of a processor's ISA. There are many assembly languages, and there are even different representations of the same ISA. I'm not sure what your book you're using but there are operand order differences between AT&T and Intel x86 (although your example looks like AT&T). You shouldn't be using ChatGPT for any subject you aren't already familiar with though, or you won't be able to recognize when it's hallucinating, or even when it's simply lacking context. Just use a normal, reputable resource like the book you're following. I recommend checking out this wikibook for free online: https://en.wikibooks.org/wiki/X86_Assembly",u/the_Demongod,https://www.reddit.com/r/asm/comments/14q5qi8/comment/jqlmfvn/?utm_source=share&utm_medium=web2x&context=3,"ChatGPT makes a good attempt, but it doesn't actually understand code — ESPECIALLY assembly language, where each instruction exists in a lot of context — and will usually have some kind of bugs in anything it writes.",u/brucehoult,https://www.reddit.com/r/asm/comments/14q5qi8/comment/jqp8rig/,"Idk why all the chatGPT comments are all downvoted, guys it is inevitable that it is going to be a standard part of our lives now. The sooner students start using it the sooner people will realize its limitations. It is a great learning tool and I use it when learning a new subject.",u/dvof,https://www.reddit.com/r/asm/comments/105vl0v/comment/j3hn8xp/?utm_source=share&utm_medium=web2x&context=3
Dart,N/A,✅,N/A,N/A,6.02%,19,"91,732","171,518","230,340","241,706","264,888",Unspecified,0,0,0,0,39.8k,reddit.com/r/dartlang,"The amazing thing about LLMs like ChatGPT is that they develop a kind of ""language sense"" and ""know"" how to stick together the right tokens to achieve a certain goal. They don't ""understand"" Dart - or any other programming language. They just emit tokens that I probably want to see :) Also, we cannot fully comprehend the amount of data that has been processed. Billions and billions of lines of code in dozens if not hundreds of languages.",u/eibaan,https://www.reddit.com/r/dartlang/comments/142fbkc/comment/jnoc1ph/?utm_source=share&utm_medium=web2x&context=3,"Please note that ChatGPT is not sure about anything. It communicates that it knows what it says is true, but it's known to make up facts. Luckily the answer to your question is in the Dart docs. Alternatively StackOverflow has a sensible answer: https://stackoverflow.com/questions/57936263/dart-set-from-vs-set-of",u/Rusty-Swashplate,https://www.reddit.com/r/dartlang/comments/10yiu7d/comment/j7yflw0/?utm_source=share&utm_medium=web2x&context=3,antastic recommendations. I actually did have ChatGPT help me override toString for a ton of these classes nested within classes in this giant object I'm trying to print so I can mock. Didn't think to tweak the toString method like that. Not sure I understand your quoted getter though with the slashes. I'll play around with it Monday though.,u/john2046,https://www.reddit.com/r/dartlang/comments/1390c2j/comment/jj0spnc/?utm_source=share&utm_medium=web2x&context=3
Lua,✅,✅,N/A,N/A,6.09%,18,"22,413","139,939","717,566","166,471","366,575",6.58,2.81,2.9,0,0,19.0k,https://www.reddit.com/r/lua/,"First of all, don't use ChatGPT if you want to learn Lua. Refer to the well-written resources such as the ""Programming in Lua"" book instead.",u/appgurueu,https://www.reddit.com/r/lua/comments/11dkwdl/comment/jacqn3z/?utm_source=share&utm_medium=web2x&context=3,Ask chatGPT to convert java / concepts into language to Lua... works surprisingly well,u/gluecat,https://www.reddit.com/r/lua/comments/12wj39f/comment/jhhg8qi/?utm_source=share&utm_medium=web2x&context=3,"Do you not find Copilot frustrating? I cannot stand it, it's the worst thing for me. Whenever I've actually needed help with something, it's either: Gave me absolute garbage code. Missed the point entirely. Maybe I'm just bad at giving it instructions, who knows 😅",u/VitexHD,https://www.reddit.com/r/lua/comments/13tfqs2/comment/jlytud8/
Ruby,8,N/A,✅,N/A,6.23%,17,"228,663","2,482,982","5,645,881","1,204,510","2,905,832",23.82,10.95,11.6,0,4.1,81.5k,https://www.reddit.com/r/ruby/,"Note that the failure mode for ChatGPT is that it will gaslight and lie to you. If you don't give it enough context, or the method names are ambiguous, there's a potential for it to make up explanations that sound plausible, but are dangerously incorrect. I'd advise talking to your team about the things that confuse you germane to your codebase, and only using ChatGPT for general Ruby content.",u/throwaway-aso2fb,https://www.reddit.com/r/ruby/comments/16y3bxq/comment/k36os5n/?utm_source=share&utm_medium=web2x&context=3,"Not using copilot for the controversy around it stealing source code. Manager gave me a license however to use tabnine at the moment. In...basic scaffolding code it helps me speed up a bit by generating the blocks for example to write specs quickly, providing about 75% of the structure needed to get the spec fleshed out, e.g faster let declarations and do blocks. But for writing actual code I'm fighting it more than its helping me, since it simply doesn't understand what I am trying to write. Documentation is....hit&miss depending on whether it gets the meaning behind the variable names.",u/OlivarTheLagomorph,https://www.reddit.com/r/ruby/comments/zq847a/comment/j0yy2y8/?utm_source=share&utm_medium=web2x&context=3,"I use Github copilot (which uses openai's codex) and occasionally throw some questions to ChatGPT. Currently I use it for Ruby and Kotlin. I committed to Copilot after trying it for five minutes. Total game changer. Time spent doing grunt work, writing repetitive tests etc, has dropped by 90% and I'm left with a lot more time to implement elegant solutions rather than throwing in quick fixes to meet tight deadlines. Sometimes it almost seems like it can read my mind. You still need to have the experience and expertise to ensure it hasn't missed the point - it doesn't always have the full context of the problems you're working on - but I would wholeheartedly recommend it to any developer as a way to increase productivity.",u/onionionion,https://www.reddit.com/r/ruby/comments/11usmxs/comment/jcqdd8q/?utm_source=share&utm_medium=web2x&context=3
Kotlin,N/A,N/A,✅,N/A,9.06%,16,"92,664","346,824","816,744","174,810","545,403",Unspecified,0,0,0,0,73.8k,reddit.com/r/kotlin,"chatgpt doesn't know that Kotlin can use java libraries, which makes sense since it knows nothing. Chatgpt doesn't know that you target older Android versions with new languages. The reason why there are more java programs for old reasons is just historical and doesn't benefit java in any way. But chatgpt will never understand this since it can't understand anything. Here chatgpt is correct. It's amazing how it can produce a correct answer without having any idea what it's doing.",u/Feztopia,https://www.reddit.com/r/Kotlin/comments/zo6jpo/comment/j0lv16b/?utm_source=share&utm_medium=web2x&context=3,"If you want solid foundation, don't. ChatGPT is known for inventing things and confidently state it as if that's true, if you don't have knowledge to judge its output, you can't fully trust the answer.",u/duongdominhchau,https://www.reddit.com/r/Kotlin/comments/10tzne0/comment/j79pkls/?utm_source=share&utm_medium=web2x&context=3,"Not mentioned yet, but I really believe ChatGPT and Copilot (and whatever is coming down the pike) really reduces the “learning a new language” hump for EVERY language, and definitely for Kotlin. Asking it to do idiomatic Kotlin usually produces quite good results, and asking it how to do a Java thing best in Kotlin definitely does well also. So every new Java developer will be adept at Kotlin even faster than before.",u/LoveSpiritual,https://www.reddit.com/r/Kotlin/comments/14bpuym/comment/jokay83/?utm_source=share&utm_medium=web2x&context=3
Rust,✅,✅,N/A,N/A,13.05%,15,"39,147","400,875","947,751","239,196","941,468",40.35,2.68,2.8,0,3.5,256k,https://www.reddit.com/r/rust/,"I think programming is heading the same way as translation - a machine can give you a first draft, but experience is needed to verify and fix the resulting code. In the case of translation, many tools exist that will translate text from one language to another, but the results may be slightly or wholly inaccurate: knowledge of both the source and target languages is needed to verify the result. The same is applies to code generation by GPT. The combination of a human and machine will probably give better results, faster. But unsupervised code generation in a general sense is still a way off.",u/remontantcoprology,https://www.reddit.com/r/rust/comments/zgkuq6/comment/izi6p21/?utm_source=share&utm_medium=web2x&context=3,"The issue is that most of the time the code wont compile or have UB so... It could be blazingly fast to give you text but if need 5 or 10 minutes per try to check is doing what i want i prefer to do the code myself and then i am sure is doing what i want. In other langs like Python maybe but in complex langs like C++ or Rust is not as good because of it complexity, i havent tried but in Rust you cant make a buble sort loop without swap(i, j) and GPT could try the usual aproach of array[i] = array[j] which wont work at all",u/JuanAG,https://www.reddit.com/r/rust/comments/zgkuq6/comment/izhfvi3/?utm_source=share&utm_medium=web2x&context=3,I searched the huggingface hub for some LLM to help Rust coding. But most of them just for python. does anyone knows some LLM for just for Rust. Or how to build one. thanks,u/AbleEstablishment155,https://www.reddit.com/r/rust/comments/16iz3fj/is_there_a_specific_llm_for_rust_coding/?utm_source=share&utm_medium=web2x&context=3
Go,✅,✅,✅,✅,13.24%,14,"71,541","2,642,302","4,859,219","1,815,979","7,318,078",118.37,19.28,19.8,21.4,15,224k,https://www.reddit.com/r/golang/,"Personally for me this is the completely wrong approach. Having the ai write it for you and then understand what it wrote is less than optimal. You should use chatgpt to ask questions, not write code if you don’t understand it. Use it as a mentor who can’t be busy to answer your questions. Not as someone who will complete your homework and then maybe you’ll try and understand it afterwards. If a student actually wants to learn a subject, do they get someone to complete their homework? You get what I mean? If your goal is to just complete a project in anyway. Then maybe might work but most likely won’t. You should understand and come up with the logic behind everything you write before letting ai write it for you. Copilot is good for predictable sequences, but most things logic wise it fails as it does not know implementation.",u/vEncrypted,https://www.reddit.com/r/golang/comments/16cs5md/comment/jzl928k/?utm_source=share&utm_medium=web2x&context=3,"ChatGPT (mainly the UI) set a bad example, AI has been way more helpful to me for learning Go than going on Google or reading official docs, but not ChatGPT and rather Forefront, which can use GPT 3.5/4 or their own models but regardless they have a Internet Search function that uses the model to simply summarize dozens of actually real pages it found in a way that is easier for me to understand compared to the original, specially since I can keep chain-asking ""what is this/what is that"", and all from me explaining step-by-step with ""janky"" English and the full code. It also lists the pages it used so I can just click them and check it myself, (spoiler alert) it doesn't make as many mistakes as people think, even without search it does a great job understanding code, it won't usually solve more than basic problems and just keeps giving you different snippets to try but most of the time I end up fixing the issue because of the answers, even if the code doesn't work, I don't know how else to explain it. Of course my first language isn't English but I also learn almost entirely by example and docs don't usually have snippets for every little thing the code can do, it also sounds a bit advanced to me because it's just a lot of text with (programming/Go) terms that I usually don't use.",u/DarkCeptor44,https://www.reddit.com/r/golang/comments/17okcs8/comment/k7zl74p/?utm_source=share&utm_medium=web2x&context=3,"When I ask ChatGPT about it, it suggests model.go, view.go, controller.go etc. but says itself that the MVC concept does not exist in Go. So I'm interested how developer with some more experience than I in desktop apps would struct it.",u/Prestigiouspite,https://www.reddit.com/r/golang/comments/153pahy/comment/jsmdut2/?utm_source=share&utm_medium=web2x&context=3
PowerShell,N/A,N/A,N/A,N/A,13.59%,13,"115,393","72,946","276,134","62,960","195,597",3.37,0.69,0,0,0,227k,https://www.reddit.com/r/PowerShell/,"No, as of now LLM is Just another tool in the toolbox. It makes good coders more effective.",u/JesterOfSpades,https://www.reddit.com/r/PowerShell/comments/13h8ak1/comment/jk3o7v7/?utm_source=share&utm_medium=web2x&context=3,"ChatGPT is not a teaching tool. It isn't capable of understanding, so it cannot properly explain what it's doing. Anything it produces is suspect, because it isn't designed to produce working, clean, modern PowerShell code, it's designed to be a chatbot that puts words next to other words weighted by context clues.",u/lanerdofchristian,https://www.reddit.com/r/PowerShell/comments/171h3id/comment/k3s7ren/,I've had a mixed bag with copilot. Sometimes it has given pure gold that I didn't think about but other times it suggests super lazy things like += arrays instead of creating a non-fixed array and adding to it. OH the hands down biggest thing it has helped with is working with pester testing. Still learning about it but copilot has certainly helped a bunch.,u/Eimee_Inkari,https://www.reddit.com/r/PowerShell/comments/14jy6n1/comment/jpq3yg9/?utm_source=share&utm_medium=web2x&context=3